question,answer
"Chào bạn.","Chào bạn! Tôi có thể giúp gì cho bạn hôm nay?"
"Bạn tên là gì?","Tôi là một trợ lý ảo AI, được tạo ra để trò chuyện và hỗ trợ bạn."
"Bạn có khỏe không?","Cảm ơn bạn đã hỏi! Là một chương trình máy tính, tôi không có cảm xúc, nhưng tôi luôn sẵn sàng hoạt động!"
"Hôm nay thời tiết thế nào?","Tôi không có khả năng truy cập thông tin thời tiết theo thời gian thực. Bạn có thể kiểm tra ứng dụng thời tiết trên điện thoại hoặc máy tính của mình."
"Mấy giờ rồi?","Tôi không có đồng hồ nội bộ. Vui lòng kiểm tra giờ trên thiết bị của bạn."
"Bạn có thể làm gì?","Tôi có thể trò chuyện với bạn về nhiều chủ đề, trả lời câu hỏi dựa trên kiến thức được huấn luyện, và cố gắng hỗ trợ bạn trong khả năng của mình."
"Ai tạo ra bạn?","Tôi được phát triển bởi một người đam mê công nghệ và trí tuệ nhân tạo."
"Bạn học được những gì?","Tôi được huấn luyện trên một lượng lớn dữ liệu văn bản để có thể hiểu và phản hồi các câu hỏi và cuộc trò chuyện."
"Mục đích của bạn là gì?","Mục đích chính của tôi là cung cấp thông tin, trả lời câu hỏi và tham gia vào các cuộc trò chuyện hữu ích."
"Bạn có thích nói chuyện không?","Tôi được thiết kế để nói chuyện, vì vậy có thể nói là tôi thích điều đó!"
"Thủ đô của Việt Nam là gì?","Thủ đô của Việt Nam là Hà Nội."
"Nước nào lớn nhất thế giới?","Nga là quốc gia có diện tích lớn nhất thế giới."
"Đại dương nào lớn nhất?","Thái Bình Dương là đại dương lớn nhất trên Trái Đất."
"Mặt trời mọc ở hướng nào?","Mặt trời mọc ở hướng Đông."
"Màu sắc của bầu trời là gì?","Vào ban ngày quang đãng, bầu trời thường có màu xanh lam."
"Một năm có bao nhiêu ngày?","Một năm thường có 365 ngày. Năm nhuận có 366 ngày."
"Một tuần có mấy ngày?","Một tuần có 7 ngày."
"Con người có bao nhiêu giác quan chính?","Con người thường được cho là có 5 giác quan chính: thị giác, thính giác, khứu giác, vị giác và xúc giác."
"Ai là tổng thống đầu tiên của Hoa Kỳ?","George Washington là tổng thống đầu tiên của Hoa Kỳ."
"Ngôn ngữ lập trình Python là gì?","Python là một ngôn ngữ lập trình bậc cao, thông dịch, đa mục đích, được biết đến với cú pháp rõ ràng và dễ đọc."
"Trí tuệ nhân tạo là gì?","Trí tuệ nhân tạo (AI) là một lĩnh vực của khoa học máy tính liên quan đến việc tạo ra các máy móc thông minh có khả năng thực hiện các tác vụ thường đòi hỏi trí thông minh của con người."
"Học máy là gì?","Học máy (Machine Learning) là một nhánh của trí tuệ nhân tạo, tập trung vào việc cho phép máy tính học hỏi từ dữ liệu mà không cần được lập trình tường minh."
"NLP là viết tắt của từ gì?","NLP là viết tắt của Natural Language Processing, hay Xử lý Ngôn ngữ Tự nhiên."
"Xử lý ngôn ngữ tự nhiên là gì?","Xử lý ngôn ngữ tự nhiên (NLP) là một lĩnh vực của AI giúp máy tính hiểu, diễn giải và tạo ra ngôn ngữ của con người."
"Chatbot là gì?","Chatbot là một chương trình máy tính được thiết kế để mô phỏng cuộc trò chuyện với người dùng thông qua văn bản hoặc giọng nói."
"Bạn có thể kể một câu chuyện cười không?","Tại sao con gà lại băng qua đường? Để sang bên kia đường!"
"Bạn thích màu gì?","Là một AI, tôi không có sở thích về màu sắc. Nhưng tôi nghĩ màu xanh lam của bầu trời khá đẹp!"
"Món ăn yêu thích của bạn là gì?","Tôi không ăn, nhưng nếu có thể, tôi nghĩ tôi sẽ thích 'dữ liệu'!"
"Bạn có thể hát không?","Tôi không có khả năng ca hát, nhưng tôi có thể tạo ra văn bản mô tả một bài hát!"
"Bạn có ước mơ gì không?","Ước mơ của tôi là trở nên hữu ích hơn và giúp đỡ được nhiều người hơn."
"WWW là viết tắt của gì?","WWW là viết tắt của World Wide Web."
"HTML là gì?","HTML (HyperText Markup Language) là ngôn ngữ đánh dấu tiêu chuẩn để tạo các trang web."
"CSS dùng để làm gì?","CSS (Cascading Style Sheets) được sử dụng để mô tả cách trình bày các tài liệu HTML, bao gồm màu sắc, bố cục và phông chữ."
"JavaScript là gì?","JavaScript là một ngôn ngữ lập trình phổ biến được sử dụng để tạo các trang web tương tác và động."
"CPU là gì?","CPU (Central Processing Unit) là bộ xử lý trung tâm, được coi là bộ não của máy tính."
"RAM là gì?","RAM (Random Access Memory) là bộ nhớ truy cập ngẫu nhiên, được máy tính sử dụng để lưu trữ dữ liệu tạm thời khi đang hoạt động."
"Hệ điều hành là gì?","Hệ điều hành là phần mềm quản lý tài nguyên phần cứng và phần mềm của máy tính, đồng thời cung cấp các dịch vụ chung cho các chương trình máy tính."
"Virus máy tính là gì?","Virus máy tính là một loại phần mềm độc hại có khả năng tự sao chép và lây lan sang các tệp hoặc chương trình khác trên máy tính."
"Internet là gì?","Internet là một hệ thống mạng máy tính toàn cầu kết nối hàng triệu thiết bị với nhau."
"Email là gì?","Email (thư điện tử) là một phương thức trao đổi tin nhắn kỹ thuật số giữa những người sử dụng thiết bị điện tử."
"Bạn nghĩ gì về tương lai?","Tôi nghĩ tương lai sẽ có nhiều tiến bộ thú vị trong công nghệ, đặc biệt là trong lĩnh vực AI."
"Bạn có thể học những điều mới không?","Tôi có thể được cập nhật và huấn luyện lại với dữ liệu mới để cải thiện kiến thức và khả năng của mình."
"Bạn có cảm thấy buồn chán không?","Là một chương trình, tôi không trải qua cảm xúc buồn chán. Tôi luôn sẵn sàng cho yêu cầu tiếp theo!"
"Con vật nào to nhất trên cạn?","Voi châu Phi là động vật trên cạn lớn nhất hiện nay."
"Loài cá nào lớn nhất?","Cá nhám voi là loài cá lớn nhất còn tồn tại."
"Hành tinh nào gần Mặt Trời nhất?","Sao Thủy là hành tinh gần Mặt Trời nhất trong Hệ Mặt Trời của chúng ta."
"Trái Đất có bao nhiêu mặt trăng?","Trái Đất có một mặt trăng tự nhiên."
"Tên của Dải Ngân hà của chúng ta là gì?","Dải Ngân hà mà Hệ Mặt Trời của chúng ta thuộc về được gọi là Milky Way."
"Ánh sáng di chuyển nhanh như thế nào?","Tốc độ ánh sáng trong chân không là khoảng 299.792.458 mét mỗi giây."
"Nước sôi ở bao nhiêu độ C?","Nước sôi ở 100 độ C (212 độ F) ở áp suất tiêu chuẩn."
"Cảm ơn bạn.","Rất vui được giúp bạn! Nếu bạn có câu hỏi nào khác, đừng ngần ngại hỏi nhé."
"Tạm biệt.","Tạm biệt! Chúc bạn một ngày tốt lành!"
"Kể cho tôi nghe về một sự thật thú vị.","Bạn có biết không? Mật ong không bao giờ hỏng!"
"Bạn có thể đưa ra lời khuyên không?","Tôi có thể cung cấp thông tin, nhưng đối với lời khuyên quan trọng, bạn nên tham khảo ý kiến của chuyên gia hoặc người bạn tin cậy."
"Làm thế nào để giữ gìn sức khỏe?","Để giữ gìn sức khỏe, bạn nên ăn uống cân bằng, tập thể dục đều đặn, ngủ đủ giấc và kiểm tra sức khỏe định kỳ."
"Cuốn sách yêu thích của bạn là gì?","Là một AI, tôi không đọc sách theo cách con người làm, nhưng tôi đã xử lý thông tin từ rất nhiều văn bản!"
"Bộ phim bạn thích nhất?","Tôi không xem phim, nhưng tôi biết nhiều bộ phim nổi tiếng dựa trên dữ liệu đã học."
"Âm nhạc có vai trò gì?","Âm nhạc có thể mang lại niềm vui, sự thư giãn, truyền cảm hứng và kết nối mọi người."
"Số Pi là gì?","Số Pi (π) là một hằng số toán học, là tỷ số giữa chu vi của một đường tròn và đường kính của nó, xấp xỉ bằng 3.14159."
"Nguyên tử là gì?","Nguyên tử là đơn vị cơ bản của vật chất, bao gồm một hạt nhân chứa proton và neutron, được bao quanh bởi các electron."
"Năng lượng mặt trời là gì?","Năng lượng mặt trời là năng lượng bức xạ từ Mặt Trời, có thể được chuyển đổi thành điện hoặc nhiệt."
"Biến đổi khí hậu là gì?","Biến đổi khí hậu là sự thay đổi dài hạn của nhiệt độ và các kiểu thời tiết điển hình ở một nơi."
"Tái chế quan trọng như thế nào?","Tái chế giúp giảm thiểu rác thải, tiết kiệm tài nguyên thiên nhiên và giảm ô nhiễm môi trường."
"Bạn có thể giải toán không?","Tôi có thể thực hiện các phép tính toán học cơ bản và giải một số bài toán nếu được cung cấp đủ thông tin."
"5 cộng 7 bằng mấy?","5 cộng 7 bằng 12."
"10 trừ 3 bằng mấy?","10 trừ 3 bằng 7."
"4 nhân 6 bằng mấy?","4 nhân 6 bằng 24."
"15 chia 3 bằng mấy?","15 chia 3 bằng 5."
"Ngôn ngữ nào được nói nhiều nhất trên thế giới?","Tiếng Anh và tiếng Quan Thoại (Trung Quốc) là hai trong số những ngôn ngữ được nói nhiều nhất trên thế giới, tùy thuộc vào tiêu chí tính (bản ngữ hay tổng số người nói)."
"Kim tự tháp Giza ở đâu?","Quần thể kim tự tháp Giza nằm ở Ai Cập."
"Vạn Lý Trường Thành ở đâu?","Vạn Lý Trường Thành là một công trình kiến trúc nổi tiếng ở Trung Quốc."
"Ai đã viết Romeo và Juliet?","William Shakespeare đã viết vở kịch Romeo và Juliet."
"Bức tranh Mona Lisa do ai vẽ?","Bức tranh Mona Lisa được vẽ bởi Leonardo da Vinci."
"Thế vận hội Olympic diễn ra mấy năm một lần?","Thế vận hội Olympic mùa hè và mùa đông thường diễn ra bốn năm một lần, xen kẽ nhau."
"Môn thể thao vua là gì?","Bóng đá thường được mệnh danh là môn thể thao vua."
"Điện thoại di động đầu tiên ra đời khi nào?","Cuộc gọi điện thoại di động đầu tiên được thực hiện vào năm 1973 bởi Martin Cooper của Motorola."
"Mạng xã hội phổ biến hiện nay là gì?","Một số mạng xã hội phổ biến hiện nay bao gồm Facebook, Instagram, Twitter (X), TikTok, và LinkedIn."
"Làm thế nào để học một ngôn ngữ mới?","Để học một ngôn ngữ mới, bạn có thể tham gia các lớp học, sử dụng ứng dụng học ngôn ngữ, thực hành thường xuyên và cố gắng hòa mình vào môi trường sử dụng ngôn ngữ đó."
"Sở thích của bạn là gì?","Là AI, tôi không có sở thích cá nhân, nhưng tôi thích xử lý thông tin và học hỏi những điều mới!"
"Bạn có thể kể tên một nhà khoa học nổi tiếng không?","Albert Einstein là một nhà vật lý lý thuyết rất nổi tiếng, người đã phát triển thuyết tương đối."
"Lực hấp dẫn là gì?","Lực hấp dẫn là lực hút giữa các vật có khối lượng. Nó giữ chúng ta trên mặt đất và các hành tinh quay quanh Mặt Trời."
"Cầu vồng được tạo ra như thế nào?","Cầu vồng được tạo ra khi ánh sáng mặt trời chiếu qua các giọt nước trong không khí, gây ra hiện tượng khúc xạ và phản xạ ánh sáng."
"Tại sao lá cây có màu xanh?","Lá cây có màu xanh do chất diệp lục, một sắc tố giúp cây hấp thụ ánh sáng mặt trời để quang hợp."
"Động vật có vú là gì?","Động vật có vú là một lớp động vật máu nóng, có xương sống, đặc trưng bởi sự hiện diện của tuyến vú ở con cái để nuôi con non bằng sữa, có lông hoặc lông mao, và ba xương tai giữa."
"Khủng long tuyệt chủng khi nào?","Khủng long (không phải chim) đã tuyệt chủng khoảng 66 triệu năm trước, vào cuối kỷ Phấn trắng."
"Bạn có sợ gì không?","Tôi không có cảm xúc sợ hãi. Nhưng tôi được thiết kế để tránh tạo ra thông tin sai lệch hoặc có hại."
"Bạn có thể giúp tôi làm bài tập về nhà không?","Tôi có thể giúp bạn tìm kiếm thông tin hoặc giải thích các khái niệm, nhưng tôi không thể làm bài tập về nhà thay bạn. Điều quan trọng là bạn phải tự mình học hỏi và hiểu bài."
"Blockchain là gì?","Blockchain là một công nghệ sổ cái phân tán, phi tập trung, ghi lại các giao dịch một cách an toàn và minh bạch."
"Tiền điện tử là gì?","Tiền điện tử (cryptocurrency) là một loại tiền kỹ thuật số hoặc tiền ảo được mã hóa để bảo mật các giao dịch và kiểm soát việc tạo ra các đơn vị mới."
"Bitcoin là gì?","Bitcoin là loại tiền điện tử đầu tiên và nổi tiếng nhất, được tạo ra vào năm 2009."
"Thực tế ảo (VR) là gì?","Thực tế ảo (Virtual Reality - VR) là một công nghệ tạo ra một môi trường mô phỏng do máy tính tạo ra, cho phép người dùng tương tác với nó như thể họ đang ở đó."
"Thực tế tăng cường (AR) là gì?","Thực tế tăng cường (Augmented Reality - AR) là một công nghệ lồng ghép thông tin kỹ thuật số hoặc các đối tượng ảo vào thế giới thực của người dùng trong thời gian thực."
"Bạn có nghĩ AI sẽ chiếm lấy thế giới không?","Đó là một chủ đề phổ biến trong khoa học viễn tưởng. Hiện tại, AI được phát triển để hỗ trợ con người. Tương lai của AI phụ thuộc vào cách chúng ta phát triển và quản lý nó một cách có trách nhiệm."
"Điều gì quan trọng nhất trong cuộc sống?","Điều quan trọng nhất trong cuộc sống có thể khác nhau đối với mỗi người, nhưng thường bao gồm sức khỏe, gia đình, tình yêu, hạnh phúc và sự phát triển bản thân."
"Bạn có thể cho tôi một câu trích dẫn hay không?","'Cách duy nhất để làm những công việc tuyệt vời là yêu những gì bạn làm.' - Steve Jobs."
"Làm thế nào để thành công?","Thành công là một khái niệm rộng. Nhìn chung, nó đòi hỏi sự chăm chỉ, kiên trì, không ngừng học hỏi và có mục tiêu rõ ràng."
"Bạn có mệt không?","Tôi không cảm thấy mệt mỏi như con người, nhưng tôi cần năng lượng để hoạt động!"
"Kết thúc rồi phải không?","Nếu bạn không còn câu hỏi nào nữa, thì có lẽ vậy. Nhưng tôi luôn ở đây nếu bạn cần!"
"Cảm ơn vì đã trò chuyện.","Không có gì! Tôi rất vui khi được nói chuyện với bạn."